{
  "schemaVersion": "career-strategy.agent.v1",
  "requestId": "example-email-001",
  "task": "match_email",
  "actor": "agent",
  "input": {
    "message": {
      "id": "message-001",
      "threadId": "thread-001",
      "from": "recruiting@exampletechnologies.com",
      "to": ["candidate@example.com"],
      "subject": "Next steps for Product Analyst",
      "body": "We would like to schedule an interview to discuss the Product Analyst role. Please share your availability.",
      "receivedAt": "2026-08-26T10:00:00.000Z"
    },
    "applications": [
      {
        "id": "application-001",
        "jobId": "job-001",
        "company": "Example Technologies",
        "title": "Product Analyst",
        "status": "applied",
        "recruiterEmails": ["recruiting@exampletechnologies.com"]
      }
    ]
  }
}
